{
  "version": 1,
  "type": "project",
  "build_tools": [
    {
      "repo": "siatd-generic-local",
      "library": "ThirdParty/protoc",
      "version": "3.5"
    }
  ],
  "libraries": [
    {
      "repo": "siatd-generic-local",
      "library": "API/PA.JtagProgrammer",
      "version": ">=17.0"
    },
    {
      "repo": "siatd-generic-local",
      "library": "API/PA.Hal",
      "version": "3.0"
    }
  ]
}
