{
  "version": 1,
  "type": "project",
  "build_tools": [
    {
      "repo": "siatd-generic-local",
      "library": "Tools/DeployToSystemUpdate",
      "version": "*"
    }
  ],
  "libraries": [
    {
      "repo": "siatd-generic-local",
      "library": "API/PA.VirtualMachine",
      "version": "2.0.0",
      "dependency_type": "runtime"
    }
  ]
}