{
  "version": 1,
  "type": "solution",
  "build_tools": [
  ],
  "libraries": [
    {
      "repo": "example-generic-local",
      "library": "test/SourcePackage",
      "version": "1"
    },
    {
      "repo": "example-generic-local",
      "library": "Test/nonExistingPackage",
      "version": "*",
      "for_archs": ["ASDF", "BCDE"]
    }
  ],
  "projects": ["Implementation", "Qualification"],
  "generators": ["msbuild", "cmake", "headercheck"]
}
